[{"claim_id":"claim_sepsis_bl_recommend","claim_type":"recommendation","decision_table_ids":[],"etd":{"acceptability":"accepted standard of care per JSICM","benefits":"28日死亡率の有意な低下 (RR 0.75, 95%CI 0.63-0.89)","certainty":"moderate","equity":"widely available in Japanese hospitals","feasibility":"feasible in ICU setting","harms":"アナフィラキシーリスク (βラクタムアレルギー患者)","recommendation_direction":"for","recommendation_strength":"strong","resources":"standard hospital formulary","source_span_ids":["span_rec_sepsis_bl","span_evidence_sepsis"],"values":"mortality reduction valued highly by panel"},"evidence_atoms":[{"certainty":"moderate","confidence_interval":{"lower":0.63,"upper":0.89},"effect_measure":"relative_risk","evidence_type":"meta_analysis","outcome_importance":"critical","pico_ref":"cq_sepsis_abx","source_span_ids":["span_evidence_sepsis"],"table_cell_refs":[],"value":0.75}],"gloss_en":"Beta-lactam antibiotics are strongly recommended for adult sepsis patients","gloss_ja":"敗血症患者にはβラクタム系抗菌薬の投与を強く推奨する","pico":{"comparator":"非βラクタム系抗菌薬","cq_id":"cq_sepsis_abx","exclusions":["βラクタムアレルギー既往"],"intervention":"βラクタム系抗菌薬投与","outcomes":["28日死亡率","ICU在室日数"],"population":"成人敗血症患者","scope":"inpatient ICU","source_span_ids":["span_rec_sepsis_bl","span_evidence_sepsis"]},"profiles":["CKC-Evidence","CKC-Norm"],"rule_ids":["rule_sepsis_bl_recommend"],"source_span_ids":["span_rec_sepsis_bl","span_evidence_sepsis"],"status":"candidate","workflow_fragment_ids":[]},{"claim_id":"claim_bl_contra","claim_type":"contraindication","decision_table_ids":[],"evidence_atoms":[],"gloss_en":"Beta-lactam antibiotics are contraindicated in patients with a history of beta-lactam anaphylaxis","gloss_ja":"βラクタム系抗菌薬にアナフィラキシーの既往がある患者には同系統薬の投与は禁忌である","profiles":["CKC-Norm"],"rule_ids":["rule_bl_anaphylaxis_contra"],"source_span_ids":["span_contra_bl_allergy"],"status":"candidate","workflow_fragment_ids":[]}]