{"claim_id":"claim_sepsis_bl","claim_type":"recommendation","decision_table_ids":[],"evidence_atoms":[{"certainty":"moderate","confidence_interval":{"lower":0.45,"upper":0.82},"effect_measure":"odds_ratio","evidence_type":"outcome_effect","outcome_importance":"critical","pico_ref":"cq_sepsis_abx_001","source_span_ids":["span_ev_001"],"table_cell_refs":[],"value":0.62}],"gloss_en":"Strongly recommend beta-lactam for sepsis","gloss_ja":"敗血症にβラクタム系抗菌薬の投与を強く推奨する","pico":{"comparator":"非βラクタム系抗菌薬","cq_id":"cq_sepsis_abx_001","exclusions":["βラクタムアレルギー"],"intervention":"βラクタム系抗菌薬投与","outcomes":["28日死亡率"],"population":"成人敗血症患者","scope":"inpatient_icu","source_span_ids":["span_gl_s1"]},"profiles":["CKC-Evidence","CKC-Norm"],"rule_ids":["rule_sepsis_bl_001"],"source_span_ids":["span_gl_s1"],"status":"candidate","workflow_fragment_ids":[]}